{
  "phase": "running",
  "stageId": "apps",
  "taskLabel": "Installing your apps",
  "detailLabel": "Installing Cursor",
  "itemIndex": 2,
  "itemTotal": 5,
  "progressPct": 42.5,
  "progressMode": "determinate",
  "profileName": "Projection Test",
  "elapsedMs": 125000,
  "groupLabel": "",
  "banner": "",
  "bannerKind": "",
  "logDir": "C:\\Users\\Public\\WinMint\\Logs",
  "updatedAt": "2026-01-01T00:00:00+00:00"
}
