{
  "phase": "finishing",
  "stageId": "finish",
  "taskLabel": "Finishing up",
  "detailLabel": "Almost done",
  "itemIndex": 0,
  "itemTotal": 0,
  "progressPct": 95,
  "progressMode": "indeterminate",
  "profileName": "Projection Test",
  "elapsedMs": 240000,
  "groupLabel": "",
  "banner": "",
  "bannerKind": "",
  "logDir": "C:\\Users\\Public\\WinMint\\Logs",
  "updatedAt": "2026-01-01T00:00:00+00:00"
}
